id,text,anger,fear,joy,sadness,surprise
deu_train_track_a_01284,"I invested a 5-digit sum in equipment to ""look at the stars"" on a balcony in a large city and thus fulfill a childhood dream of mine.  Astronomy has nothing to do with zodiac signs. One is science, the other is like globules.  & my favorite pictures: [ Thanks for all the interesting questions. I have to leave for a few hours now, but will continue answering in the evening.  Edit2: Wow, I didn't expect such a great response. Many thanks for the great and interesting questions! I'll check back on Monday evening if anyone else has any questions :)",0,0,1,0,0
deu_train_track_a_01285,"This could be a new version of Tales from the Crypt ;)  Thanks for sharing, we'll stay tuned!",0,0,1,0,0
deu_train_track_a_01286,"I experienced something similar last week, but I can't describe it as well as you can. It was very nice to read",0,0,1,0,0
deu_train_track_a_01287,What do you think can be done in schools to teach people media skills so that they at least don't fall for the obvious fakes?,0,0,0,0,0
deu_train_track_a_01288,"Hi, it's nice that you're writing here. I often feel the same way myself. You have to force yourself to do something. The good thing is that after a down comes an up again - so you'll be fine.  It also helps some people to set themselves a kind of time limit, 2 days and then it goes on. Best wishes and lots of energy :) (:",0,0,1,0,0
deu_train_track_a_01289,Most software is not updated as regularly as is actually necessary. There are sometimes such serious security gaps in it. It's a wonder that there are comparatively few major leaks or cyberattacks.,0,1,0,0,0
deu_train_track_a_01294,"As someone who has worked at a funeral home, I can tell you that this is one of the most normal things. Death is part of life. I have seen a lot of parents with their baby at funerals and it didn't bother anyone.",0,0,0,0,0
deu_train_track_a_01295,"When you go to the swimming pool, you logically have to go into a changing room to get changed. To be honest, ""family changing rooms"" don't mean anything to me now, only group changing rooms. But it doesn't matter, I don't see the problem, or I didn't understand the question.",0,0,0,0,0
deu_train_track_a_01297,"So firstly, I would definitely like more because I truly adore this setting. I, being the lovecraft and horror fan that I am, love the fishing village setting so abnormally much it's incredible and you've realized it with these two chapters in a brilliance that amazed me to no end. Thank you for allowing me to read such a work and I am honestly most excited to see where this story goes from here.",0,0,1,0,0
deu_train_track_a_01299,"Great, thanks for the quick reply! 👍",0,0,1,0,0
deu_train_track_a_01300,All my followers who live in the Küsren region:Stay safe. I'm keeping my fingers crossed that everything goes well #Zeynep #Sturm,0,1,0,0,0
deu_train_track_a_01301,"Only the Ukrainians have the right to decide and negotiate a diplomatic solution, they pay the price and they are the only ones entitled to be able to quantify the value of their freedom. As partners we can only provide as much help as possible, thanks to every autocrat sees how defensible a liberal democracy can be!",1,0,0,0,0
deu_train_track_a_01303,Why is Israel above all international laws?,1,0,0,0,1
deu_train_track_a_01304,"In my experience, this can only be changed to a very limited extent. You like dominant men, he's not dominant. Maybe he lacks creativity, imagination or it just doesn't match his personality.  People often make the mistake of thinking that everyone must like a similar kind of sex or be into this or that kind of thing. Some people are worlds apart and he's not on the path to your sexual normality. He's arrived at his.",0,0,0,1,0
deu_train_track_a_01305,Madness 😳 I can still remember when a Mr. Dirk Müller predicted exactly that over a year ago!,0,0,0,0,1
deu_train_track_a_01306,I collected 3k with that picture 4 months ago. Good luck to you! Good taste in image selection.,0,0,1,0,0
deu_train_track_a_01308,We are now discussing an amendment to the statutes to give the JA a permanent place on the state executive committee. #LPT #AfD #Stuttgart,0,0,0,0,0
deu_train_track_a_01312,"The deep problem lies in your mindset.   If your brain immediately decides a woman between 'available' or not, even though subconsciously, it means you already have the intention in your head to find and date someone new.   Were you emotionally dependent on your last relationship? You may be looking for a replacement.  You have to work on that yourself.",0,0,0,0,0
deu_train_track_a_01313,I knocked out a baby tooth on one of those pedal bikes when I was a little boy in kindergarten in the early 90s... The sight of it makes me shudder,0,1,0,0,0
deu_train_track_a_01314,"One step forward, two steps back. After years(!) I've finally taken care of my debts so that I can finally get them off my mind. Yesterday a tooth broke halfway through. I don't know if I'll manage to go to the dentist, but it's a tooth that's visible when I smile. I feel sorry for myself and hate myself at the moment, which stops me from doing other important things.",1,1,0,1,0
deu_train_track_a_01315,I have the feeling I need to see it.  But nobody wants me to see blood.,0,1,0,0,0
deu_train_track_a_01317,"You can slowly recognize the pigeon in him. ""Back then"", when he was still a little chick, I wouldn't have guessed what kind of bird it was.",0,0,0,0,1
deu_train_track_a_01318,"First of all, I wish you all the best and hope that the symptoms subside soon.  As far as I know, gynecologists are not supposed to issue employment bans. My gynecologist also said that if she were allowed to, she would actually send every pregnant woman to BV.  Have you already been to a company doctor about this?  My employer sent me to the one for our region to be on the safe side. He sent me straight to the BV.  Unfortunately, I've also found out that there are stricter and less strict ones...",0,0,0,1,0
deu_train_track_a_01320,"I think this refers to the 12th week of pregnancy. That means from the first day of your last period before pregnancy, which is about 2 weeks before you can even be pregnant.   Someone else can explain why that is, unfortunately I don't understand it either. :D Is it about ""full"" months to calculate?",0,0,0,0,0
deu_train_track_a_01321,How is it that you speak such excellent German?  What would you say Russians think about Germany?  Thanks for the Q&A.,0,0,0,0,0
deu_train_track_a_01322,The thought of a serious illness doesn't let me sleep at night.,0,1,0,0,0
deu_train_track_a_01324,Only love for Stumpf &lt;3,0,0,1,0,0
deu_train_track_a_01326,"I also had an early miscarriage during my last pregnancy, but was not prescribed any tablets. (Now in the 35th week) I would simply see it as support. Progesterone is especially important up to the 12th week and if you can reduce the chance of another miscarriage, it's a good thing. But if you are unsure, ask your doctor again or read the package leaflet.",0,0,0,1,0
deu_train_track_a_01330,I finally pulled myself together and left the church today. And it feels good.,0,0,1,0,0
deu_train_track_a_01331,Thank you for that! Your work for the cause is so important! 🖤✊🏾,0,0,1,0,0
deu_train_track_a_01332,"Is something serious going on between your ex-fiancée and your oldest friend now?   Wow, really wild story. I've only seen it in movies and series.",0,0,0,0,1
deu_train_track_a_01333,"I had this with my big one too, half a roll was enough to keep me full for half the day. It was just stupid because I was fully breastfeeding and my midwife really talked me into it because it just wasn't healthy for me and my child.  I was back to my pre-pregnancy weight within 2 months... I tried to eat more and took a lot of breastfeeding vitamins because I also had a severe iron deficiency. After a few months I was back to my pre-pregnancy weight but until then I really had to remember every meal, I set myself alarms and we often went out to get something.",0,0,0,0,0
deu_train_track_a_01334,AfD is right-wing. But by no means right-wing extremist. There is a huge difference.,0,0,0,0,0
deu_train_track_a_01335,"Hi, I'm going to be a father for the first time and have a question about ultrasound appointments. Did you take time off every time or how did you do it? How often is it during pregnancy?   Thank you for your help.",0,0,0,0,0
deu_train_track_a_01337,"What happens if there is damage? It can always happen. Be it when parking or with one of the special requests. Or to put it another way. Have you already broken something? Have they perhaps even tried to cheat you or a colleague out of damage?   How did you get poached by your new employer? Were you simply asked ""hey, do you want to drive for me from tomorrow?""",0,0,0,0,0
deu_train_track_a_01339,"I'm already ill, but I'm not that ill yet.",0,0,0,0,0
deu_train_track_a_01340,My sister lan keep your distance ‼️‼️,1,0,0,0,0
deu_train_track_a_01341,"Are you perhaps good-looking? Babyface, 5'7""? If so, I think it has to do with the fact that people think they can do anything with you because you are shorter and have a baby face and want to tease you because you look better than them.  (Please excuse my German, I'm still learning Ü)",0,0,0,1,0
deu_train_track_a_01343,"As the oldest of your siblings, it's your job to convince all the younger ones that you found them in the trash hat🤝🏼",0,0,1,0,0
deu_train_track_a_01344,The USA should moderate itself in admonishing Israel. Israel is acting morally right.,0,0,0,0,0
deu_train_track_a_01346,Why is there suddenly silence about the manslaughter in Münster? Why are the perpetrators being reinterpreted as victims?,1,0,0,0,1
deu_train_track_a_01347,Just like in the past in 🇵🇱 under communist rule.,0,0,0,0,0
deu_train_track_a_01348,The idea is great! I bet you are a role player! Thanks for the great story!,0,0,1,0,0
deu_train_track_a_01349,"The best vacation of my life was a Mongolia expedition. Covering 4,000 off-road kilometers across this wonderful, wild country was breathtaking. The hospitality of the nomads was just as impressive as their way of life. EVERYTHING is recycled, no garbage or leftovers are left behind when the family looks for a new location after a few weeks.  Fantastic country and people.",0,0,1,0,1
deu_train_track_a_01350,"Greetings. A few weeks ago, a police officer near here shot three times at a fleeing vehicle.  The car had probably accelerated beforehand and drove straight towards the officer. As far as I know, the officer could take a week's leave to write reports for each bullet.  Is it really that bad with the paperwork for something like that?",0,0,0,0,0
deu_train_track_a_01351,What a surprise! My parents gave me a car as a present.,0,0,1,0,1
deu_train_track_a_01352,"Next time, please take my cats, my wife, our fishing rods and me with you. That's pretty cheeky, don't you think? :P",0,0,1,0,0
deu_train_track_a_01353,"This may be an unpleasant question, but I've been wondering for some time how it is with paraplegia: do you have bowel movements, or do you notice when you need to, despite being paralyzed?",0,0,0,0,0
deu_train_track_a_01355,I'm 24 and since 2020 I've been a patient in a correctional facility due to an offense from 2019 under the influence of alcohol.  Feel free to ask anything you are interested in and maybe learn a little from my mistakes :),0,0,0,0,0
deu_train_track_a_01356,"I think you have to differentiate between ""side effects of medication"" and ""vaccination reaction"". When you vaccinate, the body goes on full defense - that's fine - even if there is no danger.  Side effects would be if you get a third arm or green pustules on your bottom.",0,0,0,0,0
deu_train_track_a_01358,"The easiest way is to inform the police. They have the opportunity to record the accident and there is also the option of submitting a report to check your fitness to drive (Section 2 Paragraph 12 StVG). This report is the quickest way to inform the driving license office of such incidents.   And regarding your tip about leaving a note at the accident, legally speaking this is not enough to fulfill your obligations. There are various rulings that, despite the note, removal from the scene of the accident is complete. And the consequences are high penalties.",0,0,0,0,0
deu_train_track_a_01359,"Get well soon, I'm really sorry about that :/ Unfortunately, many people don't realize that real cat bites (even from your own cat) should always be checked by a doctor and can be emergencies.  We almost had to force our work colleague to go to the doctor once because she said it wasn't that bad and you can't see anything yet. The doctor was not at all happy about how relaxed she took it!",0,1,0,1,0
deu_train_track_a_01360,I'm so sorry for you.  I always try to be grateful for the good times we had together and hold on to the positive memories.,0,0,0,1,0
deu_train_track_a_01361,The driver who wanted to get on the highway at 0:37 got a good scare.,0,0,0,0,0
deu_train_track_a_01363,"I'm from Berlin, but unfortunately I can't tell you anything about your question. I just wanted to leave you with a little language tip: c-section means 'caesarean section' in German, to avoid confusion :) All the best to you!",0,0,0,0,0
deu_train_track_a_01365,Many shelves would be empty,0,1,0,0,0
deu_train_track_a_01366,"Funny crocodile Edit: thanks for the awards, the first time I've received any, and then for such an intellectually valuable comment!",0,0,1,0,1
deu_train_track_a_01367,"Definitely start now.  I ""only"" started in the 12th week and many were already full.  I don't like phoning so much, so I also emailed some midwives when an address was given to find out if they still had capacity.  Do you have any friends who can recommend a midwife to you? If you can fall back on the personal experience of others, that's also a good thing.  You are entitled to a midwife in any case, so make use of this, no matter what your background is. The midwife not only takes care of the newborn, but also of the new mom.",0,0,0,0,0
deu_train_track_a_01368,"I think Boris Johnson renounced his US citizenship because as a US citizen he would have had to pay taxes there too. What about you, does that apply to everyone or only from a certain income? Or can you avoid it?",0,0,0,0,0
deu_train_track_a_01371,The bad critters when you turn off the light in the cellar and run back upstairs.,0,0,0,0,0
deu_train_track_a_01373,"If you would like to support her, maybe just get in touch via chat to see if and where you can help her.   Depending on how close you are, you could offer to help her around the house, bring her food, go shopping or just be there for a while.",0,0,1,0,0
deu_train_track_a_01375,Another step forward but you are really cute !!!,0,0,1,0,0
deu_train_track_a_01376,"Depends on the lab in the end. I'm pretty sure that 5 days is the guideline, but I've also heard of longer waiting times. A good doctor will look at them again and then let you know or let you know what the results are. I think they will give themselves a few more days for this.",0,0,0,0,0
deu_train_track_a_01378,I also now need a size 38 from 36/37.  But this is only after my second pregnancy. I was no longer able to wear a size 36 after the first one. My podiatrist said that this is not so rare because more weight presses on the feet and you often get wider feet.,0,0,0,0,0
deu_train_track_a_01380,It's mainly our opponents who have the sequences when they run off the long balls.,0,0,0,0,0
deu_train_track_a_01384,I am incredibly happy for you!  It's never too late to find love :)  Wish you all the best <3,0,0,1,0,0
deu_train_track_a_01388,"I come from a very uneducated Hartz IV family and was the only person in my entire (extended) family to attend grammar school and graduate from high school. I then studied at home and abroad, now work and am part of the middle class. It all still feels very surreal to me.  EDIT: With a few exceptions, I am really positively surprised by the respectful and open-minded approach to the topic. I would like to thank everyone who has interacted with me here in this way.",0,0,1,0,1
deu_train_track_a_01390,"What do you have to do to emigrate there? And what do you need to bear in mind? Not just in terms of the actual process of emigrating, but also in terms of the biggest changes in life. Question as someone who also wants to do this later",0,0,0,0,0
deu_train_track_a_01391,"There were two guys at school who were fighting. I went over and tried to pull them apart. I grabbed one of them from behind, both arms were on his body, and pulled him backwards with a jerk. I broke his right arm that way.  The way you do it, you do it wrong.",0,0,0,1,0
deu_train_track_a_01392,"Very nice! Also got the little animal nicely in focus, I like the exposure too. Very good :)   My girlfriend is also a bit talented and I often try to compete and improve myself :D Stay tuned",0,0,1,0,0
deu_train_track_a_01394,"As everyone else has said... Cyto and rubella are no fun when you're pregnant. If you're hesitant about going to the ban, it's best to ask yourself beforehand if you're someone who would be quick to blame yourself if it unfortunately doesn't quite work out in the end.  As you probably know, many early pregnancies are still terminated up to the 14th week, sometimes for no reason at all, but unfortunately there are many who still wonder or even blame themselves if they should have done something differently, as my GP once advised me.",0,1,0,0,0
deu_train_track_a_01395,Very cool. It makes my collector's heart very envious - but of course you're welcome. Keep them in honor. 👌👍,0,0,1,0,0
deu_train_track_a_01396,"It's beautifully written, but it sounds like the ultimate goal is suicide. Or am I wrong?",0,1,0,1,0
deu_train_track_a_01397,"Get fit. Life is orders of magnitude better when you're fit.  On the other hand, it's never too late.",0,0,1,0,0
deu_train_track_a_01399,"You can't really tell at this early stage, but period-like cramps are at least nothing out of the ordinary. Your uterus is already stretching. I also had pain like this at the very beginning, but more in the upper part of my abdomen and in my back instead of further down as is usually the case with my period, and not as severe. Everything was fine for me. Good luck!",0,0,0,0,0
deu_train_track_a_01401,"I think it was around the 20th week of pregnancy that I felt the little one. Due to the anterior placenta, however, I never had any big bumps on my tummy caused by kicking, even at the end of the pregnancy.",0,0,0,0,0
deu_train_track_a_01403,Born to be a cop. All that's missing are the Oakleys pressed onto the thumb.,0,0,0,0,0
deu_train_track_a_01409,It is not only Ukrainian children who are affected. Children of other nationalities often do not get a place at school promptly either. Despite compulsory schooling.,0,0,0,1,0
deu_train_track_a_01410,"Well, nothing can go wrong with this optimism 😅",0,0,1,0,0
deu_train_track_a_01411,I'm afraid that I'll never find the right partner.,0,1,0,0,0
deu_train_track_a_01412,"I think I would rather throw family planning overboard. In the end, you don't know how the pregnancy will work out anyway. The second child could be a long time coming and then you would have prematurely dropped out of an apprenticeship, which might not have been necessary. Or you could become pregnant again early on, unplanned. Children are really difficult to plan. What's more, siblings can get on well or badly with each other, regardless of age. If it makes you feel any better, I've been told that it's actually quite pleasant when the first child is a bit older, then it's a bit easier than having two small children (even if I can't say anything about that personally)",0,1,0,0,0
deu_train_track_a_01413,"Sorry, but when I hear questions along these lines, I really wonder what is wrong with some people... ""My mother wants me (a few years old) to do something that I don't want to do. What do I do now?"" You are a man who has been an adult for six years and who is in love with someone with epilepsy. There's nothing wrong with that and your mother has no right to interfere",1,0,0,0,0
deu_train_track_a_01414,Does anyone know a good alternative to Digga? Looking for something with class. Maybe even classy.,0,0,0,0,0
deu_train_track_a_01415,"The worst maybe a few months, medium / mild - about 20-25 years. But I'm still not happy and satisfied.",0,0,0,1,0
deu_train_track_a_01416,Very good 🌷. I hope it stays that way :). Unfortunately not me 😭.,0,0,1,1,0
deu_train_track_a_01417,"Bad news. That looks like two females, recognizable by the long laying spine on the abdomen. You'll probably have to come up with new names.",0,0,0,0,1
deu_train_track_a_01418,Being afraid is normal. Everyone has them. That's why it's very brave of you to take this step!,0,0,1,0,0
deu_train_track_a_01419,"Hi, I am currently 7 weeks and 1 day pregnant with my first baby and couldn't be happier about it! Unfortunately I suffer from constant nausea that lasts all day and all night. I rarely throw up, but it is very uncomfortable... plus the constant feeling of fullness makes it hard for me to eat much.  Maybe someone has a good tip for me!  Thank you :)",0,0,0,1,0
deu_train_track_a_01420,"It's so stressful here, I just want to ride relaxed but no, I live on a mountain with hills",0,0,0,1,0
deu_train_track_a_01423,How exactly do your obsessive thoughts manifest themselves? Do they also result in compulsive actions0 (e.g. compulsive washing)?,0,0,0,0,0
deu_train_track_a_01424,"How can I imagine the rooms in such a home - each child their own room? Group rooms? Group bathrooms? In what group sizes does life take place?  What is the typical daily routine?  Is the ""once in, stay in until 18"" routine typical or are there often more changes in and out?  What did you envy the ""house children"" (or what do you call them?) for, where were they perhaps envious of you?",0,0,0,0,0
deu_train_track_a_01426,You've got to be kidding me,1,0,0,0,1
deu_train_track_a_01429,How do you do something like that on the scrotum? It seems impossible to me. Or have I misunderstood and it's only about the buttock crease?,0,0,0,0,1
deu_train_track_a_01432,"What type of school are you in and in which federal state? Can the secretary's office, the deputy principal or your former class teacher perhaps help? Otherwise, contact the school authority or regional council and complain to them.",0,0,0,0,0
deu_train_track_a_01435,"The nursing tops from H&M are great. I can only recommend them.   There are also collection cups (I have the ones from Medela) that you can put in your nursing bra or wear with the nursing top. Especially if you are breastfeeding on one side, you can use them to catch the milk that leaks out on the other side.    If you then smooth it out a little, your breasts won't leak as quickly. At least that's how I got it under control. The advantage is that you can also freeze it.    There are also women who always wear the drip trays in their tops, but then no longer use the milk for feeding, preferring to put it in the bath water.",0,0,1,0,0
deu_train_track_a_01436,"Good move, don't let the hate get you down. ✌",0,0,1,0,0
deu_train_track_a_01437,">Both parents are very conservative (no sex before marriage) and want us to complete our respective master's degrees before we get married.  Good for them, how is that your problem?  Why don't you move into your own apartment or at least a shared room? I don't know your financial situation, but if you're thinking about a hotel, I think you can afford a room in a shared flat.",0,0,0,0,0
deu_train_track_a_01438,"What was it like for you when he became more and more extreme? Was the process very gradual or were you too naive to see it at the time (not meant to be an attack, not everyone is well versed in everything)? Or were you under so much psychological pressure that it was difficult to see clearly?  Could there theoretically have been legal consequences for you, since you knew about a potential threat?",0,0,0,0,0
deu_train_track_a_01439,Long Covid triggered by the vaccination. This should not be concealed!!!,1,0,0,0,0
deu_train_track_a_01440,"Hi op, & there was a very old joke, which is along the same lines as yours. Two women are talking to each other and one complains: ""My husband is late again, he's probably cheated on me!"". The other replies: ""Don't be so pessimistic. Maybe he was run over by a car.""  & in other words, you don't know why she's not there. Better to call and make sure everything is okay. And if she simply doesn't answer, or just doesn't feel like seeing you, well. Life goes on.",0,0,1,1,0
deu_train_track_a_01442,Yes sick even brother imagine she looks really cute and talks like ali says all of a sudden what do you want allerr,0,0,0,0,1
deu_train_track_a_01443,"Thanks for the tip! I hadn't heard of him before, but respect.",0,0,1,0,0
deu_train_track_a_01444,Why funny jz,0,0,0,0,1
deu_train_track_a_01445,"Unfortunately, many people generally lack empathy and sensitivity for other people and animals, but also for themselves. But they didn't choose to lead such a life, just as you didn't choose your life with all its difficulties and problems.",0,0,0,1,0
deu_train_track_a_01446,"There is an exemption from co-payments that you can apply for from health insurance companies.  You can get this if your co-payments are more than 2% of your annual gross income, or 1% for the chronically ill. Maybe this is the case for you, then I would apply for it if I were you",0,0,0,0,0
deu_train_track_a_01447,Why don't all politicians plead for peace every day? It's bizarre not to have heard the call for a peaceful solution even once in the last two years 🙇🏼‍♀️,1,0,0,0,0
