id,text,anger,fear,joy,sadness,surprise
deu_train_track_a_00001,"Hello to all readers, as I am now staying at home for a while, I have a lot of time to read and hopefully clarify many questions. I am also looking for helpful literature on the subject of pregnancy!  What books can you recommend to help me prepare a little?  Which book has eased your fears or been particularly helpful?",0,1,0,0,0
deu_train_track_a_00002,You've probably been to different countries if you dare to do something like that. Where would you rank the experience in Iraq? How was the food? How much money did you spend? Were there many tourists?,0,0,0,0,0
deu_train_track_a_00003,"when you play for money at bingo, they start arguing ;-)",0,0,0,0,0
deu_train_track_a_00005,"I was already pregnant at the time of the second vaccination and so far the child still has a normal number of arms and legs.  Perhaps it is more of a precautionary measure because it is not yet possible to say for sure whether and how the vaccination will affect pregnancy (although the data from the USA, for example, do not give cause for concern).",0,0,0,0,0
deu_train_track_a_00007,except against gladbach 😭,0,0,0,1,0
deu_train_track_a_00009,Somehow I miss the steps between elementary school and freshman year.,0,0,0,0,0
deu_train_track_a_00010,"Reduce hours from 40 to 35, work 7 instead of 8 hours every day and if you do work longer, leave earlier on Fridays, i.e. after 6 hours and then you don't need a 30-minute break. I start every day at 6:30 am and finish at 2 pm or 12:30 pm on Friday",0,0,0,0,0
deu_train_track_a_00011,This is art and art comes from being able to. 😜😂👍,0,0,1,0,0
deu_train_track_a_00012,Pessimists' answer: The companies will line their pockets anyway.,1,0,0,0,0
deu_train_track_a_00013,We help the vaccination victims among us...,0,0,0,1,0
deu_train_track_a_00014,"I once had an online acquaintance who had a similar problem (I think). He said nothing interested him and he just couldn't find any hobbies. I don't know if that's the same for you.  I think when you've been depressed for a long time, you can forget what it feels like to be interested in something. I would understand you in that respect (if that's what you meant).",0,0,0,1,0
deu_train_track_a_00015,"Bro, your parents _must_ pay you alimony. That's not charity, it's the law. Or you can get Bafög if they don't have enough money. In cases where this is not possible (e.g. because you have been studying for too long), you can get a student loan from the state. Unlike Bafög, you have to pay it back 100%, but only late and in small installments. It's absolutely okay to study for 1 or 2 years with it.   I'm very sorry that your parents don't understand. Go to therapy anyway, keep going as best you can. I've seen that some parents come to realize and understand after a while, I wish you that!",0,0,0,1,0
deu_train_track_a_00016,"How political weight is increasing: With #Verdi on their side, #Neubauer and #FridaysForFuture are becoming real players in German domestic politics. That's good 👍!!! #Climatestrike #WeRideTogether",0,0,1,0,0
deu_train_track_a_00017,"Does synaesthesia have a correlation with high intelligence? Of the two synaesthetes I know, one person has had their high intelligence confirmed and I'm pretty sure the other has it too. I also think it's obvious that this ""having more retina"" could also have a connection to intelligence somewhere.",0,0,0,0,0
deu_train_track_a_00021,"Yes, but it depends on what I'm watching. I often watch ""with"" and not necessarily what I would watch alone, then it's rather the other way around.",0,0,0,0,0
deu_train_track_a_00022,The first post in this sub where I don't feel bad giving an upvote. Very nicely described. I wish you a great future together.,0,0,1,0,0
deu_train_track_a_00024,sick now you have even less,0,0,0,0,0
deu_train_track_a_00026,"Learned today that a young woman in the neighborhood who was mildly affected by #MECFS for 2 years after a #Corona infection is now severely affected as well.   We are just so powerless against this disease, so more research is urgently needed. #LongCovid",0,1,0,1,0
deu_train_track_a_00027,"Fortunately, the balance of power will change in the fall - finally an end to the Groko&Ampel men.",0,0,1,0,0
deu_train_track_a_00028,It's really tricky. Can you get some distance from each other? You do a day for yourself and then she does it in return? It seems that neither of your needs are being met right now.  Ask her what she needs to become more balanced.  And think about what you need to become more relaxed?  Corona and then two such different children is exhausting for any marriage. I wouldn't throw in the towel just yet.,0,0,0,1,0
deu_train_track_a_00029,"Ukraine is demanding admission to the EU and NATO. Unlike all other ex-Soviet nations, it has never achieved this.",0,0,0,0,0
deu_train_track_a_00030,"So as much as I am annoyed by your gynecologist's reasoning, I am all the more happy for you that you have found a new job and that you are pregnant! Congratulations very, very much!",1,0,1,0,0
deu_train_track_a_00031,A small recommendation that might help you learn: This is a website where you can find news from all over the world in simple language. Also recommended for people who have just started learning German.,0,0,0,0,0
deu_train_track_a_00034,Why criticism: Isn't the dominant thought here that she is protesting against a genocide?,1,0,0,0,1
deu_train_track_a_00036,"I had that for years and eventually gave up. I still have male friends, but the women usually disappear with the relationship... It's a shame but what can you do",0,0,0,1,0
deu_train_track_a_00037,"Wow. \*.\* That reminds me: Could you perhaps commission her to draw you wearing that horrible Christmas hat? The one with the LEDs? And post it here, of course. Pleasepleaseplease ... :')",0,0,1,0,0
deu_train_track_a_00038,The people at dlh near here are always very rude to customers. What's it like there?,0,0,0,0,0
deu_train_track_a_00039,"Unfortunately I have no experience with this. I can only say that umbilical cord wrapping did not cause me any problems at all and, according to the midwife, only very rarely causes problems.",0,0,0,0,0
deu_train_track_a_00042,"Luckily, there's still local near-top soccer a stone's throw away. 😂 💙🖤",0,0,1,0,0
deu_train_track_a_00043,"I've just been to my gynecologist and told her that I want to stop taking the pill. She gave me some folic acid tablets and told me to get some. Which ones have you taken and can you recommend them or does it not matter which one you buy? What experiences have you had of what I should look out for, apart from no raw foods?",0,1,0,0,0
deu_train_track_a_00044,"My favorite clip of his is ""Oops, now they're all gone. ... Never mind, I was finished anyway."" Unfortunately, I can't find it anywhere.",0,0,1,0,0
deu_train_track_a_00045,Hey thanks for your AmA. I'm about to become a father too and would like to ask a few questions.   What advantages does it have for you?  Does she deserve more than you?  Why 3 years and not 2 or 1 year?  What help did the state give you (parental allowance)?,0,0,0,0,0
deu_train_track_a_00048,"1. honorary?  2. how does such a conversation work? Someone calls, expresses a wish for suicide, you talk and at the end you say ""OK, I'll think about it again""?  3. ever had someone kill themselves during the phone call or afterwards?",0,0,0,0,0
deu_train_track_a_00049,These people who stick to the road are interfering with traffic!,1,0,0,0,0
deu_train_track_a_00050,"Listen to the podcast by Die Linguistin, she has very helpful tips! I haven't listened to this episode yet, but I've saved it because I'm thinking about something similar. Maybe it will help you! But there are lots of other interesting episodes.",0,0,1,0,0
deu_train_track_a_00051,Wow! I didn't even know that [The xx]( was up for election. The USA really is the land of surprises.,0,0,0,0,1
deu_train_track_a_00052,"Hello Dmitrij. I've been rummaging around in your block for a while now and had to smile. I admire the fact that you can take the whole thing with such gallows humor.   I also like your taste in games. Unfortunately, I haven't been able to play Bloodborne yet because I don't have a PS4. But it would be too expensive for me to buy just one game.  I have one question for you, which might be a bit macabre. Will you update your blog when you die so that readers know?",0,0,1,1,0
deu_train_track_a_00053,Because you reply to everything that's not up to scratch.,0,0,0,0,0
deu_train_track_a_00054,Can you describe or give examples of what exactly is different about your son?,0,0,0,0,0
deu_train_track_a_00058,"I did an AMA a few years ago, and since I'm currently in bed with corona, I thought I'd use the time ""wisely"". Ask anything. :)  --- So, I'll try to get some sleep now, but since the corona won't disappear overnight (oh how nice it would be), I'll have plenty of time tomorrow to answer more questions.",0,0,0,1,0
deu_train_track_a_00060,"I had my first relationship when I was 30. Don't stress yourself out. Concentrate on yourself, do what you enjoy, or do something nice with friends, then it will come naturally. I know it sounds easier than it is, but you can't force it. You can also try dating apps to gain experience. I wish you all the best, you'll get there. Enjoy life and most importantly, even the smallest success is a step in the right direction. As soon as you focus on the positive things, no matter how small, you will radiate positive energy to the people around you.",0,0,1,0,0
deu_train_track_a_00061,Cool - just like last time - how reflective you approached the matter. You must have analyzed it very well and taken precautions. Chapeau!,0,0,1,0,0
deu_train_track_a_00063,The man cooks here often enough. Mostly at weekends or on days when he doesn't work until after 18:00.,0,0,0,0,0
deu_train_track_a_00064,"Then we should try to reach them. They are relatively active on Twitter and Facebook. If enough people talk about it, the candidates for chancellor or their parties will take a look.",0,0,0,0,0
deu_train_track_a_00065,Then you sit crying and trembling at the computer because the management is once again making its dissatisfaction known...,0,1,0,1,0
deu_train_track_a_00066,Laughter is ultimately the only thing that helps and keeps you optimistic.,0,0,1,1,0
deu_train_track_a_00067,I would say that the church in the background is the Dresden Hofkirche and on the right another tower of the palace.,0,0,0,0,0
deu_train_track_a_00070,"What's going on inside you? Probably a lot of things, but maybe you can paint us a picture of what is going on inside you right now? What thoughts and feelings are particularly prominent right now?",0,0,0,0,0
deu_train_track_a_00071,I got the vaccination directly from my gynecologist! Otherwise a family doctor's practice should also work. There are only vaccination centers here for Covid.,0,0,0,0,0
deu_train_track_a_00072,BILD should finally accuse and criticize this senseless measure!,1,0,0,0,0
deu_train_track_a_00073,Do demolition experts also work for the explosive ordnance disposal service? Or do they all come from the military EOD?,0,0,0,0,0
deu_train_track_a_00074,You mean the two words in the last sentence?,0,0,0,0,0
deu_train_track_a_00075,"Depression has nothing to do with stupidity! It's rather the opposite, because people who don't think about things think less, so most depressed people think too much and their heads work too much.  I wish you all the best and I understand your feelings.",0,0,0,0,0
deu_train_track_a_00076,The farm of the animals became the military-industrial complex of the animals.,1,0,0,0,0
deu_train_track_a_00077,"Because, and I quote; Spore's mother is a single parent, our son will never be able to eat there. Yes, thank you. Must also be discussed alongside me. I'm 8 years old, not stupid or deaf. That hurt. Just like I was told I was only playing with your son because you're rich. Do you really think your son is so disgusting that I only like him because he has an N64?",0,0,0,1,0
deu_train_track_a_00079,I had a dream. Russian and Ukrainian soldiers laid down their weapons and went to their towns. I woke up ... just dreaming.,0,0,0,1,0
deu_train_track_a_00080,"You don't have to. We were very happy with the midwives at the hospital, so we brought a birth card, sweets (no Merci) and something for the coffee fund. So, after we got home, we went back. My gynaecologist and diabetologist also got a card and something for the fund because I was so excited. That didn't occur to me with my midwife. But I wasn't really happy with the treatment she gave us either (she took great care of the crumb). So: individually. Do what you feel comfortable with. I wouldn't pack anything directly into the hospital bag.",0,0,0,0,0
deu_train_track_a_00083,"Hi. Exciting story and fun to read. I would try to make friends. Screaming probably won't help and letting yourself be eaten isn't a good ending either. Well, maybe try yelling first and then making friends. I would love a sequel, no matter what option happens.  In any case, keep up the good work!  lg",0,0,1,0,0
deu_train_track_a_00084,"As whaling has been illegal for years, 2024 is at least a few years too late!!!!",1,0,0,0,0
deu_train_track_a_00085,Where does it say that?  Isn't it done with gin the same way as with rum?,0,0,0,0,1
deu_train_track_a_00086,"Schlager Edited: To the anonymous silver donor People: Thank you very much, colon three Edited 2:To the ""hug bear"" donor People: Hug back and thank you, lower than three.",0,0,1,0,0
deu_train_track_a_00087,"Let's hope so, but in an emergency there are certainly emergency dentists in your area",0,0,0,0,0
deu_train_track_a_00088,How did you decide to do this? What were your reasons?,0,0,0,0,0
deu_train_track_a_00090,The Ukrainians are sticking their necks out for us and many other countries. They would have real problems if Putin's Go-West campaign were successful.,0,1,0,1,0
deu_train_track_a_00092,Who wants to play Unranked Casual?,0,0,0,0,0
deu_train_track_a_00093,"just turn on anne will for a moment, then you'll be so irrationally angry that you'll forget all about the full moon again",1,0,0,0,0
deu_train_track_a_00094,"The 4Enemies also post when they want haha, now I thought I had already missed it lmao",0,0,1,0,0
deu_train_track_a_00095,The tragic acceptance of this reality by many people paints a bleak picture of a humanity that turns a blind eye to the urgent need for a ceasefire in Gaza. Almost daily there is a poignant call to abandon the passive stance and lament the deep sadness that comes from rejecting a ceasefire that could save the shattered lives in Gaza. It is unbelievable!,1,0,0,1,0
deu_train_track_a_00096,I'll be in Tokyo for a week soon. What are some dishes & snacks not to be missed? What are your favorites?,0,0,0,0,0
deu_train_track_a_00097,Freedom for Palestine 🇵🇸 Even if all the media and politicians are one-sided about the genocide of the Palestinians. At some point the double standard of morality comes to an end.,1,0,0,1,0
deu_train_track_a_00098,"Hey, please don't hang your head :)  I don't think it's an easy time for anyone right now. And when you have to deal with additional individual circumstances, it's easy to feel lost or hopeless.  I've been feeling really bad the last few weeks too. I'm relatively newly separated after a long relationship, had to move back in with my parents (not the best atmosphere at home) and couldn't really distract myself because of corona.  What helped me was regular exercise. And also scheduling regular phone calls with friends and following through, no matter what the day was like or what my mood was like. Structure helps me through this confusing time. Maybe it will for you too.   And if you need someone to write to, let me know.",0,0,1,1,0
deu_train_track_a_00100,"After all, anyone who wants to deter Russia from further attacks on European countries must provide Ukraine with strong support.",0,1,0,0,0
deu_train_track_a_00101,Müll ohne Blaszczykowski und Barrios,1,0,0,0,0
deu_train_track_a_00102,The question is whether the devil is male?  And God?,0,0,0,0,0
deu_train_track_a_00103,"But if holy Ukraine has already defeated evil Russia, why are further billions in taxes being poured into it?",1,0,0,0,0
deu_train_track_a_00105,"By no means too early, rather too late. You should discuss this before you decide on a partner, as there is no room for compromise.",0,0,0,0,0
deu_train_track_a_00106,"I think she copied that from us humans. Since my girlfriend has been ""living"" here, every time someone sneezes, they say ""Gesundheit"". One of my cats has copied this and every time someone sneezes, he reacts by chirping (like when he sees a bird outside the window).  It's so cute, but unfortunately you can't take videos of it because you can't get the camera out so quickly when someone sneezes.",0,0,1,0,0
deu_train_track_a_00108,"Sometimes life circumstances or needs and goals don't match. Even the greatest love won't help. If you have to give up a significant part of your personality in order to have a relationship, you will be unhappy in the long run.",0,0,0,1,0
deu_train_track_a_00109,I don't understand why they refuse to send this Taurus. It would be better off in the Ukraine than in Germany.,1,0,0,0,1
deu_train_track_a_00110,"What do you think when a German potato like me comes up with the idea of learning Turkish? Not even for any particular reason, but just because.  While we're on the subject. Do you know of any Turkish books (novels or prose), movies/series and/or music that are perhaps not quite so conservative in their world view? They don't have to be super progressive, but I want to feel like I'm reading something more open-minded. Gender equality and LGBT+ references/themes would of course be a dream, but my hopes are low",0,0,0,0,0
deu_train_track_a_00112,What a surprise,0,0,0,0,1
deu_train_track_a_00113,"41+4, induction started at 41+3. But we were very late with that, a birth date before ET is more likely. You can find a few statistics from Switzerland on Wikipedia:",0,0,0,0,0
deu_train_track_a_00115,Why did you give 100 subs just for a shitty Minecraft house ? That's crazy to me!,1,0,0,0,1
deu_train_track_a_00117,My boss called. They want to get rid of me.  There's a threat of dismissal. It's all a misery.  I miss my life and my work so much.   Now I'm lying here crying.   #fckcovid #longcovid #mecfs,0,1,0,1,0
deu_train_track_a_00118,"I was induced because my child was too small. It was absolute hell and she was born at 3400g and 55cm.   It's not uncommon for doctors to make big mistakes with the weight, especially when the baby is lying down.  Based on my experience, I strongly advise against induction.  But you have to decide for yourself, it may be that if you get a third opinion you will get something completely different.",0,0,0,0,0
deu_train_track_a_00119,"Unbelievable, you still have to pay for it, even though you're actually advertising for Lidl.",1,0,0,0,0
deu_train_track_a_00121,Can't you stay with friends or family until you've found a new tenant? That would probably make it easier for both of you,0,0,0,0,0
deu_train_track_a_00122,Not in the mood for a third world war. How about peace?🫣,0,1,0,0,0
deu_train_track_a_00123,"What actually happens to all the soaps that are individually wrapped up in hotel rooms? I often stay in hotels for just one night on business and I always ask myself: ""Do they throw it away now?""",0,0,0,0,0
deu_train_track_a_00124,"I have also felt lonely for a very long time and have few people I feel I can confide in. I can understand how you feel. If you need someone, I am happy to listen to people.",0,0,0,1,0
deu_train_track_a_00125,Do you miss your parents from time to time?  Do your parents try to establish contact?  How did your emigration go? Were you alone or with friends/siblings?  Thank you :),0,0,0,0,0
deu_train_track_a_00126,"Hi, I've only just had my second vaccination, so I'm not 'safely through' yet either. We've now got into the habit of always testing ourselves before we meet others. Even if the tests aren't super reliable, it at least gives me a sense of security. We try to move as many meetings as possible outside, but of course that doesn't always work. As the incidence is rising in my city, I'm now also thinking about how I can/will reduce contacts further. But of course this is difficult or not very efficient unless friends and family do the same. Arrrgh!",1,1,0,0,0
deu_train_track_a_00127,"No, it works! Against exclusion, hatred and political repression",0,0,0,0,0
deu_train_track_a_00128,"A few years ago, I tried monk's pepper for a few months because I hoped it would alleviate my PMS symptoms. However, it didn't feel like it had any effect on me, neither on my mood swings nor on the length of my cycle or anything else. When I got pregnant this year, it felt very different, more like what you described above with your symptoms. If I were you, I would also take a test soon (i.e. on cycle day 36 at the latest) and then preferably in the morning straight after getting up, as that's when the tests are most conclusive.",0,0,0,1,0
deu_train_track_a_00129,"Hi u/KryztallGPF, I can tell you're feeling pretty bad at the moment. You obviously see yourself as the enemy and intend to harm yourself through destructive behavior. How often do you go through days like this? Brief context: We are professional social workers who do outreach work on forums and chats online. Our services are aimed at teenagers and young adults, to whom we offer free and anonymous support and advice. If you would like, you are welcome to send us a message. I would be very happy to hear from you! I wish you lots of strength and confidence. Best regards, Steffi from ConAction Streetwork :)",0,0,1,1,0
deu_train_track_a_00131,"Letzebuerger Magier gin checked out at Beauxbatons, net Hogwarts.",0,0,0,0,0
deu_train_track_a_00132,Reading in the dark is bad for your eyes.  Your teeth rust when you put knives in your mouth.  Swallowing chewing gum makes your stomach sticky.  Square eyes from watching TV.  Eating lots of soup makes you live longer.,0,0,0,0,0
deu_train_track_a_00133,"Yes, exactly. Due to the circumstances, just picked out of the overall plot in a somewhat scattered way.",0,0,0,0,0
deu_train_track_a_00136,It's just never worked and the majority of the players in the club play a 4-man chain,0,0,0,0,0
deu_train_track_a_00138,Were you able to determine a correlation between color and tear strength during your many tests?,0,0,0,0,0
deu_train_track_a_00139,Greetings back to you,0,0,1,0,0
deu_train_track_a_00140,"I feel similar to you. I am a special needs teacher and therefore have my professional perspective, which I cannot ignore when choosing our place of birth. Some of the children I have worked with have impairments due to birth complications such as oxygen deprivation.  Therefore, I would not feel comfortable giving birth at home or in a birthing center, but would like to have the OR next door for safety in case it is needed. In addition, first births in my family often take 2-3 days, so you would probably be transferred to hospital anyway.  Of course, you can never rule out all risks and it is ultimately up to the parents-to-be to make their own personal decision.",0,1,0,0,0
deu_train_track_a_00142,It would be a real shame if the Allianz Arena had a malfunction where all colors had to be tested.,0,0,1,0,0
deu_train_track_a_00143,"If you blocked the fan in the overhead with a piece of chalk, it overheated and switched off within a very short time, then there was a ten-minute break until two students organized a new one from the janitor. And then all over again. What a nice time.",0,0,1,0,0
deu_train_track_a_00144,"Well, the previous vaccinations also provide good and sufficient protection.",0,0,1,0,0
deu_train_track_a_00146,Ukraine begs and pleads. A dangerous game with fire! Let's hope that the request is not granted!,0,1,0,0,0
deu_train_track_a_00147,"When can/should I book a postnatal course? The little one is due at the beginning of July and I tried to book a course in the fall today, but the midwife said they don't accept registrations before the baby is born.  I actually find few classes that are supposed to start in September (despite being in a big city) - maybe they don't publish them until later? - but the ones I do find for the fall are already fully booked! A friend said she was able to book her course before the birth, but is that typical? Should I keep looking or wait and see?",0,1,0,0,0
deu_train_track_a_00148,How about peace negotiations ??? Peace Peace Peace,0,0,0,0,0
deu_train_track_a_00151,"For me, it wasn't in childhood, but when I developed fatal thoughts as a result of an unhealthy relationship with a woman in my 20s.  How do you initiate the lucid dreams?  Do you have a stated goal (accessing the subconscious, for example)?  Have you ever had a false awakening? How did you deal with it?  Thank you for the AmA",0,0,0,1,0
deu_train_track_a_00152,How do you feel about your father's unemployment?  What do you think of the Citizen's Income plans and the reaction of many people a la it's no longer worth working?  What would you as a government do differently for the long-term unemployed?  And how do you feel about other people working hard to finance the basic income support? (Not meant to be provocative),0,0,0,0,0
deu_train_track_a_00153,How do you manage not to be sick all the time when you're standing at the back of the garbage truck in the rain and cold?  & the change?  & what does salary look like for job 1 & 2?,0,0,0,0,0
deu_train_track_a_00156,"In the case of ""inwardly"" ugly, I have to pull myself together in the case of Hanni......",0,0,0,0,0
