id,text,anger,fear,joy,sadness,surprise
deu_train_track_a_01906,"Consciously only after the positive test. But I drink so rarely anyway that I didn't drink anything in the second half of my cycle ""by mistake"". Alcohol is unhealthy anyway, so you're definitely not doing anything wrong if you stop sooner rather than later.",0,0,0,0,0
deu_train_track_a_01907,"Believe CDU, Greens, SPD and FDP would all jump into bed to prevent the AfD",0,0,0,0,0
deu_train_track_a_01908,"So it helped me, I went to the **Health Practice Li** in Oerlikon and was also surprised at how beneficial a health massage can be for mental well-being. This TCM practice is run by LaBelleChine and the manager Shuyi Li assured me that the location in Pfäffikon ZH should be at least as good.",0,0,1,0,1
deu_train_track_a_01910,"Guys, I don't think much of German movie and TV productions, but ""Die Discounter"" is honestly funny",0,0,1,0,0
deu_train_track_a_01912,"I would have loved to buy an old mill, but the main thing that bothers me is safety. If the old cars were just as safe as the new ones, then I would have loved to buy a ""classic car""",0,0,0,1,0
deu_train_track_a_01915,"I wouldn't even talk about it. Just be honest, many people understand. Any bridging stories are nothing more than lies, like with your parents. I've been there, done that. Step 1: Confess to your parents Step 2: Get a job in your desired industry, without blah blah If it doesn't work out, you simply have to realize that studying isn't everything. Besides, you already have a bachelor's degree. All good. You're already better off than many. Maybe a different environment? Go for a walk and maybe try fluoxetine, it worked quite well for me.",0,0,0,0,0
deu_train_track_a_01918,"People are neurologically unable to withstand constant high levels of stress, in which case self-soothing trivialization sets in for self-protection. Or dissociation, a kind of splitting off, long known in psychology. The corona problem is simply too big because it affects ALL areas of life.",0,1,0,1,0
deu_train_track_a_01919,It is simply unbelievable that you can no longer speak out for democracy everywhere in Germany without fearing violence. .. Thank you AfD! Nothing destroys us like you!,1,1,0,1,0
deu_train_track_a_01923,Also coachella an sich wild und wilde outfits ist halt nh plus,0,0,1,0,0
deu_train_track_a_01924,"How much are you protecting / isolating yourselves during these times to prevent a coronavirus infection?   We are currently really very limited in our contacts: we are both working from home, we only meet someone outside our household once a week at most. I wanted to meet up again with friends we haven't seen for a while and my husband was undecided whether we shouldn't consciously avoid it at the moment.   I'm torn and don't want to completely isolate myself socially - being pregnant is already emotionally turbulent enough, so I don't want to be lonely at home as well. At the same time, of course, I don't want to expose myself to unnecessary risks... how do you handle this?",0,1,0,1,0
deu_train_track_a_01925,Male read migranti send a strong signal against the right in The Hague. Coming soon to your neighborhood!,1,0,1,0,0
deu_train_track_a_01926,I really can't because I'm not at home yet. So please don't hit me,0,1,0,0,0
deu_train_track_a_01927,Update: [First 38km done!]( if anyone recognizes where I am despite the blurred background!,0,0,1,0,0
deu_train_track_a_01929,"Do you have any tips on where it is safe to travel as a pregnant woman? I know there are special babymoon hotels, but they don't really appeal to me. I generally prefer to go on vacation in a hotel, in the last few years I've often been to a place in the Mediterranean, but now I can't go there because of my pregnancy (too high risk of falling, too poor medical care, ...).",0,1,0,0,0
deu_train_track_a_01931,Anyone who constantly sees the state as an enemy is not leading a good life.,0,0,0,1,0
deu_train_track_a_01932,Sounds to me like asking yourself if you are Asian because you like glass noodles better than spaghetti.   Young people are often still looking for a label that fits them. Honestly? Let everyone do what they like. Who cares if there's the right description for it?,0,0,0,0,0
deu_train_track_a_01933,"Hey congratulations first of all. I'm 17 weeks pregnant for the first time and by now the worry is a little less, just because of the statistics.... but I can really feel your panic. My gyn told me that if the anxiety gets too much, I should just call and come in for an ultrasound between regular appointments. It takes 2 minutes and you know for sure. This also made it clear to me that I'm really not alone with this fear, it's completely normal unfortunately. Maybe that would be an option for you too, to consider such a check in between appointments.",0,1,0,0,0
deu_train_track_a_01934,"I am an absolute true crime lover, read everything, watch everything, listen to podcasts etc. Since my first pregnancy, however, this has had to be planned in such a way that I either have to deal with it in the light, or if in the evening, then my husband has to be at home for the night (works the night shift). This was never the case before, and unfortunately hasn't gone away since the pregnancy. A ray of hope: it hasn't gotten any worse with the second pregnancy.",0,1,0,0,0
deu_train_track_a_01935,You are so damn hot 😍🔥,0,0,1,0,0
deu_train_track_a_01936,GM .... Your photos are always amazing,0,0,1,0,0
deu_train_track_a_01937,"Physiological sighs or temporary lip-braking breathing could help here. Otherwise, daily progressive muscle relaxation. I know these are run-of-the-mill tips, but maybe they will help you",0,0,0,0,0
deu_train_track_a_01938,"Hey, I recently turned 18 and am now looking for a psychiatrist in my area that I can trust. So someone who is sensitive and not afraid to prescribe medication, I've had bad experiences with a psychologist simply not wanting to do that even though I know that antidepressants help me.  Thanks in advance if anyone can help :)",0,1,0,1,0
deu_train_track_a_01940,"I worked a lot with refugees. Most of them definitely stayed here, and it was very difficult for them not being able to see their family. I actually only know of one case where someone went back for a vacation, and he was politically persecuted (no war); went after 7 years to see his mother, and just took the risk. I think that's really the minority, and to be honest, as long as they're isolated cases, it doesn't bother me.",0,0,0,0,0
deu_train_track_a_01941,"That's quite something. And you probably can't expect compensation or reimbursement of costs from them either, can you? After all, you didn't do anything wrong and, according to your description, you're completely innocent.  But maybe I'm thinking too naively. I've always got through every check with complete openness / never had to go to the police station. But I haven't driven a car at all for years now, so there are no more checks.",0,0,0,1,0
deu_train_track_a_01942,"I don't have to, the person making the accusation or filing the complaint has to prove it, it's called the presumption of innocence.",0,0,0,0,0
deu_train_track_a_01943,"I can sit in the sun by the river for hours in summer and just stare at myself. Most people find that pretty boring, but not me.",0,0,1,0,0
deu_train_track_a_01945,"We can win with #Ukraine or lose together with them. We are not on the road to victory. That's also because #Scholz is taking a special path with Russia, he doesn't want to deliver #Taurus or Ukraine's NATO membership @<username>",1,1,0,0,0
deu_train_track_a_01946,"Happy and healthy new year! Enjoy your orange. Unfortunately, I've never had a 10/10, so I prefer to eat mandarins. But I don't begrudge you that!",0,0,1,0,0
deu_train_track_a_01949,"This is also so beautifully written, just like your first post. You can really feel the excitement! Nice how it went :)",0,0,1,0,0
deu_train_track_a_01950,">The mars people > >I have a birthday. my friend Casten gave me a **rocket** for my birthday I had a question Do we want to fly to **Monb**? Yes, we were there, we were taken fffrrreeemmmmmtttllliiiGGGGeee by Mars people They had let us go, we went back home MaMa had just finished the pomfriz.",0,0,1,0,0
deu_train_track_a_01952,"Hedgehog like this: ""Yes, I'm eating your food. What do you want to do now, kitty?""",0,0,1,0,0
deu_train_track_a_01953,"Sooo... impossible happened and I found a midwife. Two, actually. Problem is, I can't find any reviews and they both have no website or google maps spot, there's nothing. On the midwife search on GKV there's only email and phone number. Of course, I understand that they may just be very young and straight out of school, which doesn't bother me (they'll still know more about kids than I do, haha). But I'm wondering how to understand if we're a good match, so to speak. What questions should I ask to understand if I trust her or if she's the right person?",0,1,0,0,0
deu_train_track_a_01954,BIDA if I accidentally bumped into a terrorist who was torturing kittens when he stumbled into me from behind so I couldn't see him?,0,0,0,0,0
deu_train_track_a_01955,Thank you South Africa👏 at least you don't look the other way or are not a puppet of the USA!,1,0,1,0,0
deu_train_track_a_01957,A short break before the ☕ The man builds a raised bed next to the raised bed.,0,0,1,0,0
deu_train_track_a_01959,"Knusper, knusper, knäuschen, wer DEMOLIERT DA MEIN HÄUSCHEN? WAS ZUM ARSCH!? ARE YOU STILL THERE? ICH MACH EUCH KALT!",1,0,0,0,0
deu_train_track_a_01962,"I (female) am also a bookworm, always have my book with me, but of course I know when I'm out with someone that I'm not reading. Have you already brought it up? Because communication is important and maybe he understands when you want him to put the book down when you're together. And as long as he's understanding, you can always ask him to put the book down and concentrate on you within the situation. He should understand that. If not, it will be difficult anyway.",0,0,0,0,0
deu_train_track_a_01963,"What could you be crying about? To explain it on a medical level, your estrogen may be a bit high. Maybe go to an endocrinologist and see how much testosterone you have in your blood. If it all somehow comes together perfectly, an emotion like this can arise because something is overwhelming you.",0,0,0,0,0
deu_train_track_a_01964,"The last time I had a 5 DM coin in my hand, I was particularly struck by how light they are compared to euro coins.",0,0,0,0,1
deu_train_track_a_01965,"It is simply difficult to live with someone who is depressed. It takes a lot of patience, calmness, balance and strength. If you're not completely grounded at the moment, you might not always succeed and you might blame the depressed person. Try not to take it too personally, after all, they are criticizing your illness and not you.  You can get fast-charging columns from your GP, who can prescribe antidepressants in the meantime (if you haven't already).  You are no more of a burden than someone with a broken leg or a chronic digestive disease, we as a society already package that. The thoughts of being a burden are part of your problem that needs to be solved - nothing additional.",0,0,0,1,0
deu_train_track_a_01967,Not that I would be fit. But this fight has to be done!,1,0,0,0,0
deu_train_track_a_01970,Maybe music or audio books?   But I would tell your companion to have your playlist on his/her cell phone beforehand so that he/she can take care of it. And you just have to say music please.,0,0,0,0,0
deu_train_track_a_01971,"When a beard accident was just barely avoided...  ...do you say ""This went very well again""?",0,0,1,0,0
deu_train_track_a_01972,"My first child hadn't moved from the spot since the 4th month until she rolled onto her other side once during labor. Until then, her little fists and feet were always in exactly the same place and her bottom was stuck in my ribs so that I couldn't breathe easily and couldn't lean forward :D",0,0,0,0,0
deu_train_track_a_01973,"If the clinic/doctor is really good, no.",0,0,0,0,0
deu_train_track_a_01974,"Ahoy. I took part in a 12-day expedition cruise to Antarctica as a passenger.  Definition: Expedition cruises are cruises with mostly smaller special ships, which enable travel routes off the beaten track. Expedition cruises have many other important characteristics that are not appreciated in this view. They are often seen as a hybrid between a cruise and a study trip, opening up regions that have not yet been explored by mass tourism.  Perhaps one or two people here will be interested, as it is not necessarily an everyday trip.  I look forward to your questions :)",0,0,1,0,0
deu_train_track_a_01975,A visit to the ophthalmologist would also be helpful for the poor person.,0,0,0,1,0
deu_train_track_a_01977,"How does it look for you, do you go the typical cubit length or something more specific? I'm now at 0.65m per stride and it seems a bit far to me. I'm worried about being too fast in heavy oncoming traffic, I sometimes even see older people looking anxious, but somehow I actually like it. Is that just my natural walking pace or am I perhaps a bad boy?",0,0,1,0,0
deu_train_track_a_01978,The regime would now rather destroy the country than simply disappear.,1,0,0,0,0
deu_train_track_a_01979,"The International Court of Justice considers it plausible that Israel is guilty of genocide. I would also stop the financing and arms deliveries to Israel, but since the war many people have realized that human rights only count selectively and that political and economic interests take precedence over them.",1,0,0,0,0
deu_train_track_a_01980,You misspelled 2032,0,0,0,0,0
deu_train_track_a_01982,How and when did you find out about it? What penalty did the other road user receive?,0,0,0,0,0
deu_train_track_a_01983,For all those who compare Israel with Russia: Russia attacked for no reason at all. Ukraine has never attacked or even threatened anyone. These are completely different situations. Small reminder,0,0,0,0,0
deu_train_track_a_01984,"I can well understand the approach. My thoughts would probably be the possibility of getting a part-time job in the first place, and then of course how to compensate for the loss of money. By that I also mean the money you pay into the pension scheme. I knew a person who was able to live well with this, but who only received a very small pension as a result. Does your employer offer this or do you really have to completely reorient yourself?  I think what I would change if I were you would be this shift model. Are there perhaps already options? I know from my father and many others how much it can wear on your strength.",0,0,0,0,0
deu_train_track_a_01987,"Impressive strategic success for Putin: NATO has 32 members as of today, compared to 30 before the invasion of Ukraine, and the direct border between NATO and Russia has become 1,300 km longer.",0,0,0,0,0
deu_train_track_a_01988,Dear lady I would like to take a nose 🙈,0,0,1,0,0
deu_train_track_a_01990,"Phew, that sounds like a lot of work. I'd rather go through the obituaries and cross the ones out of the phone book.",0,0,0,1,0
deu_train_track_a_01991,"You should listen to your doctor or midwife at this point - or get a second professional opinion if you are not convinced by your current doctor. Nobody here on the net can tell you whether it is too much or not. It could be water retention. In any case, it is not advisable to lose weight or follow any diet during pregnancy. The body is changing a lot now, unfortunately in some cases not the way you would like it to be, but that is part of it. In any case, it is safer to rely on medical advice and, if necessary, tests than to worry in an amateurish way.",0,1,0,0,0
deu_train_track_a_01992,"It's been 58 years, but you've held up well. 💯",0,0,1,0,0
deu_train_track_a_01993,I love this sub exactly because of stories like this! :D Thanks for sharing!,0,0,1,0,0
deu_train_track_a_01994,"Thanks for the insight into your daily struggle, Brudi. You don't usually think about it or hardly notice it.",0,0,1,0,0
deu_train_track_a_01995,Why can't I be like an eraser : Erase my mistakes One day they will disappear,0,0,0,1,0
deu_train_track_a_01996,We had one and were *extremely* happy with it. Can also be upgraded to carry two children after child 1 and is small enough for public transport (and our elevator).,0,0,1,0,0
deu_train_track_a_01997,Died unexpectedly for the 4th time in September since Friday.   Feels good. :),0,0,1,0,0
deu_train_track_a_01998,"I was 10 days over my appointment and was induced. I went for a walk until the end, but unfortunately it didn't help. Sex was out for me, I was too round for that. But it did help some people!",0,0,0,0,0
deu_train_track_a_01999,"The perspective of optimistic nihilism helps me and I could imagine that this is also something for you. [In a nutshell]( elaborated on this beautifully: ""If you can't remember the 13.75 billion years before you were born, then the trillions and trillions of years that come after you will also fly by. Close your eyes. Count to one. That's what eternity feels like.""",0,0,0,0,0
deu_train_track_a_02000,Fortunately not 😊 Good morning Lena ☀️☀️☀️,0,0,1,0,0
deu_train_track_a_02001,"Fortunately, only the light is really broken.",0,0,1,0,0
deu_train_track_a_02004,"You could also simply go vegan 🌱, which would be much better for animals, the environment, the climate and health.",0,0,0,0,0
deu_train_track_a_02005,"If you manage to put 1+1 together, then you realize that it is best for Germany, the environment and the climate for ministers to get from A to B as quickly as possible, to move as much as possible in as many places as possible in as short a time as possible, and then to recharge their batteries at home as quickly as possible.",0,0,0,0,0
deu_train_track_a_02006,It was to be expected. Down with the traffic lights,1,0,0,0,0
deu_train_track_a_02007,"Hi everyone I've been suffering from depression for a year now and in the last few weeks I've been having the problem of being hungry but not feeling like eating/preparing food and not having any ideas. I look at a lot of recipes and just think to myself that it's actually too much work. What's more, it's around 30 degrees here at the moment. Maybe you have some ideas/recipes for me, not just cold food but also cooked things.  I would be delighted to hear your answers.  Lara",0,0,0,1,0
deu_train_track_a_02008,"A colleague and I were about 14 years old when we both decided to go to the town hall because there was such a cool elevator that was permanently in operation and didn't stop. We hopped in and wanted to get to the top. When we got relatively far up, we realized that there was no other floor waiting for us, but darkness. At that moment, we both looked at each other at the same time, with the same thought that we might somehow be crushed at the top. However, it turned out that the elevator was moving from right to left in an arc and was going down again.  We laughed our heads off at first.",0,0,1,0,0
deu_train_track_a_02009,"I will, thank you!",0,0,1,0,0
deu_train_track_a_02010,"I have to be honest and admit that I always find myself avoiding walking past other people. I prefer to wait and keep my distance. And if that's not possible, like at concerts, I immediately have stupid thoughts in my head about whether the other person is ill and if so, whether I have it now. It's actually total nonsense, but that's what all the distance crap has done to me.",0,1,0,1,0
deu_train_track_a_02011,"I couldn't get vaccinated because there was no vaccine yet and later no recommendation from the Stiko. We spent the entire pregnancy in isolation. I met my sister twice in the open air and once we went to a friend's house to get baby clothes. My partner and his friend had already been vaccinated and I just stayed outside for a while. But there was no Delta then. Now the baby is over three months old and we are still extremely cautious. We rarely meet people, and when we do, we only meet vaccinated people outside. I would still do it that way if I were still pregnant.",0,1,0,0,0
deu_train_track_a_02012,"Instead of simply doing everything possible to stop the war without further armed violence. That should be the discourse, in the comments section, in the Bundestag and internationally. Ukraine will not win this on its own, not even with Western weapons",0,0,0,0,0
deu_train_track_a_02013,"The people of Gaza have been living in misery and suffering for years, and not just because of the current situation. They are being held captive in their country. All governments have ignored this. Now the whole world can see what's going on there. 🙁🙁😔😔",0,0,0,1,0
deu_train_track_a_02014,Let him stay where he is - now that he's just got going again.,0,0,0,0,0
deu_train_track_a_02015,"Sounds a bit like Ischia pain!  It's best to keep moving. Sitting too much often makes it worse - go for a walk, do some yoga.   A sitting wedge on a chair and alternating sitting on the Petzi/yoga ball has also helped me. There are also excellent exercises for the hips that you can do on the ball.   I also got a prescription for physio from the gynecologist because of Ischia - maybe that would also be an option!",0,0,0,0,0
deu_train_track_a_02017,"It was my 18th birthday, I had just come home from a trip, wanted to talk about it and then do something with my friends. I walked in the door and was handed a present with the words ""Your mother and I are getting divorced"". It wasn't entirely unexpected, but the timing was like something out of a bad comedy.",0,0,0,1,1
deu_train_track_a_02021,We will lose that 100% of the time,0,1,0,0,0
deu_train_track_a_02022,And there's an anti-Greta car in my village. Sigh...,1,0,0,0,0
deu_train_track_a_02023,"Böhmermann is fun, but I think you would only get latent-sarcastic answers here that have no relevance at all. But maybe it's worth a try :)",0,0,0,0,0
deu_train_track_a_02024,"Dear kiddos, #Don'tMakeUp",0,1,0,0,0
deu_train_track_a_02026,I was addicted to crystal for 5 years. (I also injected it) but I'm now clean,0,0,1,0,0
deu_train_track_a_02027,"Berlin is called Berlin because it was built in a swamp. In other words, a wetland. Weak mat.",1,0,0,0,0
deu_train_track_a_02028,Absolutely appropriate and legitimate for Israel to defend itself!🇮🇱✊️,0,0,1,0,0
deu_train_track_a_02029,"The picket fence Once upon a time there was a picket fence with a gap to look through. An architect who saw this suddenly stood there one evening - and took out the gap and built a big house out of it. Meanwhile, the fence stood there all stupid, with slats and nothing around it. It was a horrible and mean sight. So the senate pulled it down too. The architect, however, fled to Africa or America. Christian Morgenstern (1871-1914)",0,0,0,0,0
deu_train_track_a_02030,"I am currently 32 weeks pregnant and for about 2-3 weeks I have noticed how much more strenuous everything is becoming and unfortunately I also have problems walking because my pelvis is loosening. My belly is also really big now and it tightens in the evenings. So all in all, I've felt very pregnant since the 8th month :D",0,0,1,0,0
deu_train_track_a_02031,omg now I finally know what your name is,0,0,1,0,1
deu_train_track_a_02032,"How do you get into it, are you generally in the movie business or were you approached on the street with ""Hey, you have exactly the body we need right now!""?  And probably the most important question: Which series/movie?",0,0,0,0,0
deu_train_track_a_02033,Do they pay well?,0,0,0,0,0
deu_train_track_a_02036,But please build it right. Made from local wood.  No trees should be felled for an insect hotel. Otherwise it's a paradox.,0,0,0,0,0
deu_train_track_a_02037,"Ok, it's nice that our collaboration has come to an end. I'm very disappointed in you.",0,0,0,1,0
deu_train_track_a_02038,"I sensed the sarcasm in your words, but I lacked certainty. 🫣",0,0,0,0,0
deu_train_track_a_02040,"I just wanted to say: thank you for your openness. I'm afraid of exactly this situation, of this decision, and it's nice to read that you can deal with it. I think you are brave and admirable.   I have just one question: would you do tests out of sequence in the future?  I didn't do anything with my first child apart from the usual tests and luckily it was nothing. But based on your post, I'm now asking myself this question.",0,1,1,0,0
deu_train_track_a_02041,"1) Is it possible to narrow down your field of activity a little more? In which area of software development, for example 2.)I am still studying and find the possibility of freelancing quite interesting. What did your career look like?  3) I've often heard that customer acquisition is very difficult, especially at the beginning. How was it for you and do you have any tips?   Thanks for your effort :)",0,0,0,0,0
deu_train_track_a_02045,"I feel for you. My grandma doesn't have corona but she's very ill and weak in hospital and I can't see her. I have sent her cards and flowers, so maybe I can at least put a smile on her face. All the best!",0,0,0,1,0
deu_train_track_a_02046,One of the best talks I've found on depression so far. It's worth watching the whole video. I have linked to minute 50:07 as it deals specifically with the topic of depression.,0,0,1,0,0
deu_train_track_a_02047,"You could inform your boss, but ask him not to tell anyone yet.  You can also google: pregnant dismissal protection",0,0,0,0,0
deu_train_track_a_02048,"I've probably done the anesthetic for scraping 100 times. It is a short procedure (approx. 10 minutes) and usually always under general anesthesia, i.e. you don't notice anything.",0,0,0,0,0
