id,text,anger,fear,joy,sadness,surprise
deu_train_track_a_00642,"We're also a pretty lazy couple who like to play games and watch series, and for us the best way to balance this is a hike or a long walk in the countryside. It's super relaxing and always makes for good conversation.",0,0,1,0,0
deu_train_track_a_00644,"The sub comes at just the right time. I'm pregnant for the second time after a miscarriage in December. u/by the way, I still remember your name from the July bumper sub :)",0,0,1,0,0
deu_train_track_a_00645,"All the best for you Respect to express this story here, we humans are stand up males, after every knock down we get up again and move on guided by fate you will meet new people and you will meet someone new you have built up your friend again and again and spared no effort and for the next best she may have left you illness or not she may not have been worth it close the chapter stand up male look for a new apartment if yours bothers you, a new job and a new environment listen inside yourself and fate will guide you",0,0,0,0,0
deu_train_track_a_00647,"I'm at 39+3 and I don't feel anything at all. No training contractions, belly doesn't go down, nothing at all.  But I have an induction planned for Friday and close monitoring due to GDM. So as far as I'm concerned, it could really start now...",0,0,0,0,0
deu_train_track_a_00648,"I must say I've never heard of it before, interesting.  How does this affect your everyday life? Or on relationships?  Do you struggle with all of these symptoms or just some of them?",0,0,0,0,1
deu_train_track_a_00650,"However, not everything has to be under control",0,0,0,0,0
deu_train_track_a_00651,"I'm not familiar with the subject of employment bans during pregnancy, but I can tell you that many employers react with surprise and bitchiness. You were even more open than you should have been.",0,0,0,0,0
deu_train_track_a_00653,"I recently went hiking with friends and whenever we had to cross a bridge over a road, we waved to the drivers. Many waved back or honked :D These little moments gave us and I think also the drivers a brief smile",0,0,1,0,0
deu_train_track_a_00654,"I think it depends on how old you are.  If you're 13 now, that's very early, but from your mid-twenties it's quite good to clarify something like that.",0,0,0,0,0
deu_train_track_a_00655,"Correct, you are using it incorrectly.",0,0,0,0,0
deu_train_track_a_00657,Are they starting to get creeped out? Do they keep turning around on the street ?,0,1,0,0,0
deu_train_track_a_00658,"Hi, thanks for your AMA.   Where is your mother and her family from? Did she marry a German?  Did you run away at 19 and build your life somewhere else or how did that turn out?  Glad you are doing well now. VG",0,0,1,0,0
deu_train_track_a_00659,"Fighting right-wingers in Germany and supporting a right-wing religious government in Israel, exactly my humor 👏😂",1,0,0,0,0
deu_train_track_a_00662,"I've also been on sick leave for 10 months due to various mental illnesses, so for the first 4-5 months I got calls from the sickness fund almost every week asking how I was doing, but when they ""nicely"" asked me to give notice with a medical certificate that I was off sick pay, I was annoyed. In the meantime, I haven't received any calls since they found out that I'm going to undergo vocational rehabilitation soon.  Would that also be an option for you?",1,0,0,1,0
deu_train_track_a_00663,"I don't mean that in a bad way, but you're 1.5 hours away from each other and can't manage to meet up regularly? Or did I get that wrong?  This unconditional preservation of your own freedom has definitely caused you a lot of trouble. The question is whether she would ever want it any other way and how it should continue after your studies. You should perhaps talk about this together before false expectations arise.  But it's actually really easy for you to see each other more often until the end of your studies. My fiancée is currently studying in Munich and we actually live near Holland, so even we've seen each other more often than you have.",0,0,0,0,0
deu_train_track_a_00665,thanks for the song,0,0,1,0,0
deu_train_track_a_00666,"War is not a solution but a cycle of violence. I feel infinitely sorry for what is happening now and I can't imagine how painful it is for the civilian population. It goes against my imagination. I have a dream, I wish for a great country in which all religions can live united and peacefully.",0,1,0,1,0
deu_train_track_a_00669,"Quality man, first class, thank you for your intervention! We need more people like you",0,0,1,0,0
deu_train_track_a_00670,"I've been depressed for over 10 years (as well as borderline) and sometimes have suicidal thoughts.  I've already been to three psychotherapists, had group therapy, been to a self-help group, had occupational therapy, read self-help books, seen a psychiatrist and tried medication.  Nothing helped, it just got worse and worse over the years. I now don't know where else to turn. I contacted the telephone counseling service but only had a bad experience...",0,1,0,1,0
deu_train_track_a_00671,"90% of the time ""POV"" is used incorrectly it drives me crazy",1,0,0,0,0
deu_train_track_a_00673,"Dear leader, creator? No, I can't identify with that. I'm someone like everyone else here with the only difference being that at some point I clicked on *create subreddit*. But I'm assuming that wasn't meant seriously :)  Thanks for the announcement! Things are a bit crazy for me at the moment, which is why this got lost. I'll see if I can contribute something on Saturday.",0,0,0,0,0
deu_train_track_a_00674,That's not a bad thing because streams let your voice rest for now and I hope you'll be well again soon❤,0,0,0,0,0
deu_train_track_a_00675,"Well, she's just afraid that you'll pick up women there or something. Maybe she didn't mean for you to go straight to the club. Well, talk about it, clarify what was meant and how. You'll be fine.",0,0,0,0,0
deu_train_track_a_00679,"to speak unscrupulously of the fact that supplies have been delivered since the beginning of the war - that is not true. Because without the intervention of the USA, they would all have starved to death long ago.",1,0,0,0,0
deu_train_track_a_00681,Because he gets more on the hut and can therefore unpack more parades?,0,0,0,0,0
deu_train_track_a_00682,Break up no. Why do you always have to break up straight away? Where does the mentality come from that you have to throw someone away just because the sex isn't good? Working on it together and growing together is the only way to make sex more intense and bring you closer together.,0,0,0,0,0
deu_train_track_a_00683,"I wish your grandma all the best. :/ Unfortunately, that's all I can do. I hope she makes it.",0,0,0,1,0
deu_train_track_a_00684,The news of the death of a childhood hero hits me hard.,0,0,0,1,0
deu_train_track_a_00685,"It's important that you always keep one thing in mind, you are not responsible for the happiness of others.  Break-ups are never easy and it shows that you are concerned by seeking advice. But once you've made your decision, it won't help her or you to keep the relationship going.  If you still like her, offer to be there when she needs help. This will give her some control over the situation. You won't take away her pain, but you will show her concession and respect.",0,0,0,0,0
deu_train_track_a_00687,"Correction: RAUM Offenbach, not directly in Offenbach, mea culpa. But we are easily accessible by public transport!",0,0,0,0,0
deu_train_track_a_00688,"Actually, you've already answered your own question. Template houses are much cheaper than architectural masterpieces. If you read around on Reddit, for example, you'll see that most people take out high loans and often sew on the edge to be able to afford a property. If they had more money, most of them would probably prefer to put up something individual rather than the same old thing. So the ""have to"" correlates very strongly with the ""have"".",0,0,0,1,0
deu_train_track_a_00689,Daily consumption is harmful. Every stoner knows that too.,0,0,0,0,0
deu_train_track_a_00691,I'm not feeling well either,0,0,0,1,0
deu_train_track_a_00692,"I also stopped taking it once because I was given something else and had to be off venlafaxine first.   I slowly phased it out under medical supervision, i.e. I continued to reduce the dose over a longer period of time. That shouldn't cause any major problems. Simply stopping taking it overnight will go wrong and cause withdrawal symptoms.   I didn't have any problems other than the fact that I missed the mood-enhancing effect.",0,0,0,0,0
deu_train_track_a_00693,Bayern was Bremen's number 1 hunter,0,0,0,0,0
deu_train_track_a_00694,"I think every wind turbine should have a keeper like a lighthouse. I have no idea what he would have to do then. But I want the job, so I'd have peace and quiet.",0,0,1,0,0
deu_train_track_a_00696,"I would like to write more here, but I'll refrain.",1,0,0,0,0
deu_train_track_a_00697,"I am currently between 10 and 11 weeks gestation and am getting a booster from my FA at 12 weeks. My 2nd vaccination was in June, so 6 months before. For me it looks very important, I am asthmatic and don't want to have corona, I also have 2 toddlers at home who are not vaccinated and for me the extra protection is important",0,1,0,0,0
deu_train_track_a_00698,"Do you have a therapist? You could work with them on your anxiety. Medication might also help you, I have some and it helps me personally with anxiety quite well",0,0,0,0,0
deu_train_track_a_00699,".. Are they fixing the Dalek?  My knowledge of Doctor Who is admittedly limited, but repairing Daleks seems unwise to me",0,0,0,0,0
deu_train_track_a_00701,You are now on the hit list of washing machine manufacturers. When the doorbell rings on Sunday night - DON'T OPEN!  Hihi but congratulations :) Fixing things is so fundamentally satisfying!,0,0,1,0,0
deu_train_track_a_00703,"Mostly on the phone, but also inquiries via chat, email, letter, fax, WhatsApp, Facebook, Twitter - in fact, via pretty much every conceivable medium. My main topics were network technology, cell phone Internet and cell phone defects.  Do you want to know anything about this?",0,0,0,0,0
deu_train_track_a_00705,is going really well,0,0,1,0,0
deu_train_track_a_00706,"Yes, but unfortunately most of them are completely underdosed or poorly formulated... Especially in Germany. With a healthy diet and exercise you will sleep 90% better. I would start with that.",0,0,0,0,0
deu_train_track_a_00707,"Hi, I'm looking for recommendations for bikinis or swimsuits that I can wear for (sporty) swimming during my pregnancy.   I'm 26 weeks pregnant and unfortunately my swimsuits and bikinis no longer fit me - mainly because of the growth of my breasts (but I've also put on weight overall). Before my pregnancy I was already 80E. I don't even know where I currently stand, I think 1-2 sizes bigger.  Does anyone know of brands for large cups/sizes that ""hold"" well? Is a bikini more practical, as the belly has enough room here in the remaining weeks and I may only have to change the top if the breasts continue to grow?",0,0,0,0,0
deu_train_track_a_00708,"Congratulations and all the best for the new season, luckily you only play against my favorite club on the last matchday😄",0,0,1,0,0
deu_train_track_a_00709,"I (m35) have actually always been in long relationships, the last one lasted 11 years, including 4 years of marriage. And yes, I have to say that everything has changed, but I would say that's also down to age. I've now had two ""experiences"" after all that and each time sex was involved at the first meeting. Again, both were very open and very different from what I knew. I also had my hand on my throat straight away, which was strange but ok for me (which I didn't think). In any case, consensus is always the most important thing! I'm just going to keep an open mind and see what happens.",0,0,0,0,0
deu_train_track_a_00712,"unfortunately the comment section cannot be loaded at the moment, please try again later.",0,0,0,0,0
deu_train_track_a_00714,Does being against wind farms automatically make you a climate change denier? 🤔 Or is that the same story as during corona? I don't want a vaccination and am then immediately a corona denier?,1,0,0,0,0
deu_train_track_a_00718,"I'm thinking about putting together a little box for my wife with things she has to do without during pregnancy.  These include licorice, sushi (voucher), bath oils, a small bottle of wine. What else fits in there? What do you miss the most?",0,0,1,0,0
deu_train_track_a_00719,"Basically, from a purely medical point of view, a caesarean section increases the likelihood of further caesarean sections in subsequent births. After 2-3 caesarean sections, spontaneous vaginal births are even discouraged. But of course this does not *have* to be the case, especially after one, the chances are certainly not bad that it will work spontaneously.",0,0,0,0,0
deu_train_track_a_00720,"Don't let other dating apps talk you down. Just download it, write a bit with people and, most importantly, don't take such apps seriously.   If you see them for what they are, it's quite funny: apps where you write to strangers. And as ""nasty"" as that sounds at first, you have no obligations and simply can't write to people if you don't feel like writing to them (anymore).  I've found that if you take a relaxed approach to such apps, you quickly meet people you sympathize with. That's also how I found my girlfriend.",0,0,1,0,0
deu_train_track_a_00723,Unfortunately? The pictures are so beautiful 😃,0,0,1,0,0
deu_train_track_a_00724,"I got most of it through Vinted. I'm very happy with that.  I first made a few rough enquiries and then after a while I drew up a table so that I could keep an overview - how much do we need, do the items fit together, etc.?  I didn't get too many different brands because the sizes vary so much.",0,0,1,0,0
deu_train_track_a_00725,"This comment has been overwritten as a protest against Reddit's handling of the recent [protest against them killing 3rd-party-apps]( To do this yourself, you can use the python library [praw]( See you all on [Lemmy](",0,0,0,0,0
deu_train_track_a_00726,"The story is really beautiful. But I'm still so scared of death :( And when I hear about 70... sure that sounds old. But at almost 30, I still feel so inexperienced in life and if I get that old too, half of it will soon be over :(",0,1,0,0,0
deu_train_track_a_00727,"High-quality bras. Well made, in the right size. Makes a huge difference to comfort and the back.  Shoes High quality wash.",0,0,0,0,0
deu_train_track_a_00728,Sane really can't believe the crap he's playing today #GERHUN,1,0,0,0,0
deu_train_track_a_00729,"I had an epidural when my daughter was born and it was really great. I will also have this as an option for the birth of my son in May. You don't have to if you don't need it, but knowing that there are options to ease the pain takes away some of the fear. So for me.",0,0,1,0,0
deu_train_track_a_00730,The toddler loves to stuff building blocks into her bodysuit and gets annoyed when she can't get them out.,0,0,1,0,0
deu_train_track_a_00731,"I don't have an answer to this question, but I have to say one thing: the choice of framing is brilliant - the Mülheimer in the foreground is epic! *MadeMyDay",0,0,1,0,0
deu_train_track_a_00732,"After the first child, yes. After the second child, well, in most cases.",0,0,0,0,0
deu_train_track_a_00736,"I'm glad to hear you're getting the support you need! The wait for therapy is really tough. You might want to look into DIGAs. These are digital health applications (apps on prescription, so to speak) that can be prescribed directly by your doctor or health insurance company and are now really well researched, especially in the area of depression, and are definitely helpful for bridging the gap. Have a look at the official website on the internet, it's very detailed and if you have any questions, feel free to send me a pn. I've just done a lot of research for my studies. [DIGA directory](",0,0,1,1,0
deu_train_track_a_00738,"What are your plans after graduation? Do you want to stay in the EU or Germany or return to the hopefully soon pacified country, or are you leaving that open?",0,0,0,0,0
deu_train_track_a_00746,Spit is also just water somewhere &gt;:,0,0,0,0,0
deu_train_track_a_00747,You wouldn't believe it haunts me all my life I'm generally traumatized by it,0,1,0,1,0
deu_train_track_a_00748,"I had to show my maternity record at the booster, so I wouldn't lie about my SSW. Although I was already in my second trimester, I theoretically still had three days until the six-month interval for the second vaccination was complete - but that didn't matter and I got the vaccination without any problems.  Honestly: Take your vaccination and maternity pass, go to the vaccination center and tell them about your specific situation. Just give it a try. They can't do more than say no, and the way I see it, vaccination centers aren't being beaten down at the moment, so you could certainly hope for goodwill.",0,0,0,0,0
deu_train_track_a_00752,And because we finally need an expert in dodgeball 😂,0,0,1,0,0
deu_train_track_a_00754,"I'd rather call, I haven't really gotten any response to the emails I've written.   Simply: ""Hello, I had a positive pregnancy test last week and am now looking for a midwife, especially for the postpartum period. I'm probably in week so-and-so"" And then they'll tell you whether they're still free or not. :)",0,0,0,0,0
deu_train_track_a_00755,Lauterbach has no reasonable explanation. Maybe just be honest?,1,0,0,0,0
deu_train_track_a_00756,"I decided to do this AMA because I haven't found a post about it yet. Because this problem can affect any age group and is rarely addressed, especially in young men, I want to show others that there is no reason to be ashamed of it.  Edit:(Thanks for the many questions, if you still have questions please ask them, but I'm offline for now) &",0,0,0,0,0
deu_train_track_a_00757,Wants to cry must stop dating again,0,0,0,1,0
deu_train_track_a_00758,"At the beginning of 'roner, my local Aldi had a sign in front of the entrance that only a maximum of 88 people were allowed in. Now there's a digital counter at the top that shows how many more people are allowed in.",0,0,0,0,0
deu_train_track_a_00759,I'm afraid I might lose my job. The economy is so uncertain.,0,1,0,0,0
deu_train_track_a_00760,"Hello, I am currently in my 12th week of pregnancy and have already gained just under 10 kg. I am 170 cm tall and weighed 55 kilograms before my pregnancy. I have actually always had enough exercise because of soccer. I now also go for walks after work. I still eat my normal two meals. The quantity has perhaps changed a little here and I snack a little more. But that can't be the reason. According to the internet, you should hardly gain any weight during this period. Do you know why that is? Should I be worried?",0,1,0,0,0
deu_train_track_a_00761,"I agree with everything /u/ConstsAndVars has written.   But I would also advise you to take advantage of services such as [telephone counseling](. There are also other [offers of help]( Just please don't forget the most important thing: your feelings are valid and you never need to be ashamed of them! I think it's great that you want to talk about it and seek help. Even if you're not diagnosed with depression, it's right and important to get help. Because it's completely natural to go through phases of grief that overwhelm you.   A little tip: try not to brood about things. This only ever leads to you getting deeper into your grief. Meditation or mindfulness exercises help me with this.",0,0,1,1,0
deu_train_track_a_00762,Boy honestly such a machine is different &lt;3,0,0,1,0,0
deu_train_track_a_00764,Is there a plan B? It looks like Russia is making slow progress. Wouldn't diplomacy be a good idea? Otherwise Ukraine will disappear completely and more and more people will die. Then it will be too late to negotiate.,0,1,0,0,0
deu_train_track_a_00765,Hello everyone!  I am looking for a good book to accompany me through my pregnancy. A kind of handbook. I am in the 6th week. Can you recommend a good one?  Thanks in advance!   Thank you very much for your feedback! That helps me a lot :)),0,0,1,0,0
deu_train_track_a_00768,How did it go in court and what exactly was your charge?  What did your lawyer say about the sentence and why didn't you appeal?,0,0,0,0,0
deu_train_track_a_00769,"I have an underactive thyroid myself and found out shortly before my pregnancy. As far as I know, nothing will happen so quickly as she is taking L-thyroxine anyway. From the 12th week of pregnancy, the baby produces thyroid problems itself.   I just didn't quite understand one thing in your post. If the TSH value is too high, the medication is increased. If it is too low, it is reduced. What was your TSH level when the doctor called?",0,0,0,0,0
deu_train_track_a_00770,Maybe I'll get lucky 💪,0,0,1,0,0
deu_train_track_a_00771,Didn't they say 2 months ago that Palestinians were dying because Hamas was preventing them from fleeing to the south? And what is happening now? Israel is bombing the south of the occupied Gaza Strip.,1,0,0,1,0
deu_train_track_a_00772,"Remember, the highest compliment is now a 'not bad'!",0,0,0,0,0
deu_train_track_a_00773,the last sentence. That's when he remembered the Monday morning drunk.,0,0,0,0,0
deu_train_track_a_00774,"embarrassing who doesn't cry on the train in the morning when rapk raps ""little brother, little thief""",0,0,0,1,0
deu_train_track_a_00775,"Courageous, and you don't need to be afraid of it.",0,0,1,0,0
deu_train_track_a_00776,Italian juvenile prisons are full of kids who cooked ketchup spaghetti.   #mustknow,0,0,0,0,0
deu_train_track_a_00777,"But after 7 years, the ""I don't really know yet"" train has simply left the station. You should both know exactly what you have or don't have in each other and you should be able to decide whether or not you want this for the rest of your lives.  However, this also includes dealing with the unpleasant truth that it may not be what you want for the rest of your life.",0,0,0,1,0
deu_train_track_a_00778,You are on a school trip/holiday camp/etc. and are allowed to choose a song for the morning to wake you up via the house system. Which song is it?,0,0,1,0,0
deu_train_track_a_00779,boah crave honestly making out with sbd so bad,0,0,0,1,0
deu_train_track_a_00780,"Just get away from the idea that drugs are so terrible.  Many problems only arise because of the taboo or illegality.  If everything were legal and available in high quality and at a reasonable price, then we wouldn't have most of the problems.  Heroin used to be available in pharmacies, anyone who wanted to could grow weed. I'm sure we could also grow varieties that grow without special heat lamps. So that everyone can grow their own stuff on the balcony.  & no, I don't smoke weed or take any other mind-expanding substances. I just think that we are handling it very wrong at the moment.",0,0,0,0,0
deu_train_track_a_00783,Not a cent more for climate protection!,1,0,0,0,0
deu_train_track_a_00785,Bruh I can't read sorry my fault,0,0,0,0,0
deu_train_track_a_00787,"So far I only have a little pain in my upper arm, but otherwise I feel the same as always",0,0,0,0,0
deu_train_track_a_00788,I think Lidl always has some things on sale online. Maybe have a look there too!,0,0,0,0,0
deu_train_track_a_00789,"friendly reminder that as an occupying power, it is actually Israel's duty to provide basic public services and would not need #UNRWA refugees if Israel had complied with UN Res 194 and let them return to their homes.",1,0,0,0,0
deu_train_track_a_00792,Selensky or Ukraine must seek peace negotiations. Enough is enough...,1,0,0,0,0
deu_train_track_a_00794,honestly have never been so heart broken by guys and haven't even met one,0,0,0,1,0
deu_train_track_a_00795,I didn't get anything from the coronavirus. Not even a cold. Not even this winter. I have been vaccinated 3 times against Corona and have no complaints. I hope it stays that way,0,0,1,0,0
deu_train_track_a_00797,BE STILL WOMAN!  I SAY NO TO LUST BECAUSE INSIDE I THIRST FOR BLISS...  AAAAAHAHHAHAAAAAAAAH,1,0,1,0,1
deu_train_track_a_00799,"I had something similar, my midwife recommended magnesium tablets which also helped.   I used nipple shields for breastfeeding because my nipples hurt. It could also be due to the nursing pads you are using. The cheap ones are not so comfortable. I now have the ones from NUK, which I can get cheaper on Amazon.",0,0,0,0,0
deu_train_track_a_00802,"Just a little tip, your husband only has protection against dismissal 7 (?) weeks before you give birth. It may make sense for him not to announce the pregnancy.   - Child benefit - parental allowance - parental leave - childcare if necessary - health insurance - maternity protection - clarify insurance - I am only familiar with civil service regulations in BW",0,0,0,0,0
deu_train_track_a_00803,How are you doing with the vaccination? Did you get appointments? Who is vaccinating and who is not? Do you have or have you had side effects and what is the timeframe like for you?  **EDIT: Those who have been vaccinated or are planning to do so can take part in a** [**observational study by Charite**]( **in order to improve the data situation and thus provide a better basis for decision-making for recommendations by societies.** EDIT2: Side effect report 3 days after vaccination - my arm hurt a bit for 2 days and I slept like a baby - without a pee box interruption (I usually have 2-3 courses per night). All good!,0,0,0,0,0
deu_train_track_a_00804,And politics in this country supports such genocide and distribution with weapons and money!!!,1,0,0,0,0
